{
  "$schema": "https://json-schema.org/draft/2020-12/schema",
  "$id": "https://codellm-devkit.github.io/schema/neo4j/contract.schema.json",
  "title": "codeanalyzer Neo4j graph contract",
  "description": "Meta-schema for the schema.neo4j.json document each codeanalyzer emits with `--emit schema`. The document describes the graph an analyzer writes — node labels, relationship types, and the constraints and indexes the loader creates — so it is a contract about a graph, not a JSON Schema for analysis.json. Its schema_version is an independent line from the analysis schema version: an analyzer can sit on analysis schema v1 while its graph contract is on 2.x.",

  "x-cldk": {
    "kind": "neo4j-graph-contract",
    "sources": [
      { "repo": "codellm-devkit/codeanalyzer-java", "release": "v2.4.1", "schemaVersion": "1.0.0", "path": "schema.neo4j.json" },
      { "repo": "codellm-devkit/codeanalyzer-python", "release": "v1.1.1", "schemaVersion": "2.0.0", "path": "schema.neo4j.json" },
      { "repo": "codellm-devkit/codeanalyzer-typescript", "release": "v1.0.0", "schemaVersion": "2.0.0", "path": "schema.neo4j.json" }
    ],
    "note": "The copies under neo4j/<lang>/ are byte-identical to the tagged release, so `diff` against the analyzer repo is the drift check. They are pinned to the latest release, not to whatever sits on main.",
    "validates": ["*/schema.neo4j.json"]
  },

  "type": "object",
  "required": ["schema_version", "generator", "node_labels", "relationship_types"],
  "additionalProperties": false,

  "properties": {
    "schema_version": {
      "description": "Version of the graph contract itself, independent of the analysis schema version.",
      "type": "string",
      "pattern": "^\\d+\\.\\d+\\.\\d+$"
    },
    "generator": {
      "description": "Analyzer that emitted this contract, e.g. codeanalyzer-java.",
      "type": "string"
    },
    "marker_labels": {
      "description": "Extra labels attached to nodes that satisfy some property (e.g. JEntrypoint), rather than to a node kind.",
      "type": "array",
      "items": { "type": "string" }
    },
    "node_labels": {
      "type": "array",
      "items": { "$ref": "#/$defs/NodeLabel" },
      "minItems": 1
    },
    "relationship_types": {
      "type": "array",
      "items": { "$ref": "#/$defs/RelationshipType" },
      "minItems": 1
    },
    "constraints": {
      "description": "Cypher CREATE CONSTRAINT statements the loader runs before ingest.",
      "type": "array",
      "items": { "type": "string", "pattern": "^CREATE CONSTRAINT " }
    },
    "indexes": {
      "description": "Cypher CREATE INDEX statements the loader runs before ingest.",
      "type": "array",
      "items": { "type": "string", "pattern": "^CREATE (INDEX|FULLTEXT INDEX|VECTOR INDEX) " }
    }
  },

  "$defs": {
    "NodeLabel": {
      "type": "object",
      "required": ["label", "key", "properties"],
      "additionalProperties": false,
      "properties": {
        "label": {
          "description": "Neo4j label written on the node.",
          "type": "string",
          "pattern": "^[A-Za-z][A-Za-z0-9_]*$"
        },
        "merge_label": {
          "description": "Label used in the MERGE that upserts the node, when it differs from `label`. Java and Python spell this merge_label; TypeScript spells it mergeLabel. Either is accepted here — the divergence is real in the shipped contracts.",
          "type": "string"
        },
        "mergeLabel": {
          "description": "TypeScript's spelling of merge_label. See the note on merge_label.",
          "type": "string"
        },
        "key": {
          "description": "Property that uniquely identifies a node with this label.",
          "type": "string"
        },
        "properties": {
          "description": "Property name to property type. Values are contract type names, not JSON Schema types.",
          "type": "object",
          "additionalProperties": { "$ref": "#/$defs/PropertyType" }
        }
      },
      "anyOf": [
        { "required": ["merge_label"] },
        { "required": ["mergeLabel"] }
      ]
    },

    "RelationshipType": {
      "type": "object",
      "required": ["type", "from", "to"],
      "additionalProperties": false,
      "properties": {
        "type": {
          "description": "Relationship type written on the edge, e.g. PY_HAS_MODULE.",
          "type": "string",
          "pattern": "^[A-Z][A-Z0-9_]*$"
        },
        "from": {
          "description": "Node labels this edge may start at.",
          "type": "array",
          "items": { "type": "string" },
          "minItems": 1
        },
        "to": {
          "description": "Node labels this edge may end at.",
          "type": "array",
          "items": { "type": "string" },
          "minItems": 1
        },
        "properties": {
          "type": "object",
          "additionalProperties": { "$ref": "#/$defs/PropertyType" }
        }
      }
    },

    "PropertyType": {
      "description": "Contract-level property type. This is the set the three shipped contracts use; extend it when an analyzer starts emitting a new one.",
      "type": "string",
      "enum": ["string", "integer", "float", "boolean", "string[]", "integer[]", "float[]", "boolean[]"]
    }
  }
}
